{
  "schemaVersion": 1,
  "skill": "verification-before-completion",
  "expertiseSources": [
    {
      "type": "specification",
      "reference": "docs/research/anthropic-spec.md",
      "summary": "Documents the strict portable frontmatter contract and rejection of runtime-specific fields."
    }
  ],
  "comparison": null,
  "exception": {
    "type": "compliance",
    "rationale": "Removes host-specific frontmatter to satisfy the portable Agent Skills profile without changing the verification workflow."
  }
}
