{
  "schemaVersion": 1,
  "skill": "external-skill-review",
  "expertiseSources": [
    {
      "type": "specification",
      "reference": "docs/research/anthropic-spec.md",
      "summary": "Documents the strict portable frontmatter contract and rejection of runtime-specific fields."
    }
  ],
  "comparison": null,
  "exception": {
    "type": "compliance",
    "rationale": "Removes host-specific invocation metadata to satisfy the portable Agent Skills profile while retaining the review-only safety workflow."
  }
}
